countryCode,countryName,cityCode,cityName,HotelCode,HotelName,HotelRating,Address,Attractions,Description,HotelFacilities,Map,PhoneNumber,PinCode,HotelWebsiteUrl,Reviews
KR,South Korea,150271,Gangneung,1768307,Daegulryeong Village,All,17 Seongyeon-ro Seongsan-myeonGangneung 25450,,"Located in Gangneung, Daegulryeong Village features accommodation 14 km from Gangneung Olympic Park. Complimentary WiFi is provided.

Fitted with a terrace, the units feature a flat-screen TV and a private bathroom with shower and free toiletries. A microwave and fridge are also available, as well as a kettle.

The holiday home offers a barbecue.

The property has a playground.

Kwandong University is 8 km from Daegulryeong Village. The nearest airport is Yangyang International Airport, 48 km from the property.",Free self parking Garden Terrace Non-smoking rooms Facilities for disabled guests Internet access Express check-in Children s playground BBQ facilities Heating Luggage storage Free WiFi Free WiFi Non-smoking throughout Parking onsite Private parking Wheelchair accessible,37.7227|128.81523,,25450,https://www.booking.com/hotel/kr/daegulryeong-village.html,You get what you pay for |  Only the park outside of the hotel was beautiful  |  Breakfast very good |  The Staff was friendly and helpful the location is not that bad let s say 20 25 minutes by walk from the Central train station and may be 45 minutes 1 hour from the Duomo di Milano the price is not that high for the service you get comparing with other hotels in Milan  |  Everything of my stay was very good
KR,South Korea,150255,Yeosu,1836311,Yeosu Demare Pool Villa,ThreeStar,"149 Pyeongsa Ro Dolsan Eup 149, Pyeongsa-ro Dolsan-eupYeosu 59776 ",Distances are displayed to the nearest 0.1 mile and kilometer.  Bangjukpo Beach - 10 km / 6.2 mi  Maritime & Fisheries Science Museum - 11.4 km / 7.1 mi  Hyang-Il-Am - 16 km / 10 mi  Yeosu Cable Car - 18.5 km / 11.5 mi  Dolsan Park - 18.6 km / 11.6 mi  Dolsandaegyo Bridge - 19.4 km / 12.1 mi  Aqua Planet Yeosu - 20.3 km / 12.6 mi  Yi Sun Shin Square - 20.8 km / 12.9 mi  Yeosu International Pavilion - 21 km / 13 mi  Yeosu romantic carriage street - 21.2 km / 13.2 mi  Jinnamgwan Hall - 21.5 km / 13.3 mi  Jasan Park - 22.3 km / 13.8 mi  Odongdo - 23.2 km / 14.4 mi  Odong-Do Fountain - 23.2 km / 14.4 mi  Admiral Soon-Shin Lee Memorial - 23.2 km / 14.4 mi  The nearest major airport is Yeosu (RSU) - 41 km / 25.5 mi,"HeadLine : In YeosuLocation : With a stay at Demare in Yeosu, you ll be within a 15-minute drive of Bangjukpo Beach and Maritime & Fisheries Science Museum.  This pension is 13.2 mi (21.2 km) from Yeosu romantic carriage street and 10 mi (16 km) from Hyang-Il-Am.Rooms : Make yourself at home in one of the 12 guestrooms, featuring kitchenettes with refrigerators and microwaves. Flat-screen televisions with cable programming provide entertainment, while complimentary wireless Internet access keeps you connected. Conveniences include electric kettles and rice cookers.Dining : Satisfy your appetite at the pension s coffee shop/caf. For your convenience, a complimentary breakfast is served daily from 9:30 AM to 10:30 AM.Renovations : The following facilities or services will be unavailable from July 2 2020 to December 31 2020 (dates subject to change): Swimming poolCheckIn Instructions : Extra-person charges may apply and vary depending on property policy Government-issued photo identification and a credit card, debit card, or cash deposit may be required at check-in for incidental charges Special requests are subject to availability upon check-in and may incur additional charges; special requests cannot be guaranteedSpecial Instructions : The front desk is open daily from 9:00 AM - 8:00 PM. This property doesn t offer after-hours check-in. Front desk staff will greet guests on arrival.",Front desk (limited hours) Barbecue grill(s) Free breakfast Spa services on site Terrace Coffee/tea in common areas Coffee shop or caf - 1 Free self parking Free WiFi Garden Fully fenced,34.61719|127.72169,82-10-3737 1493,59776,,best hotel in town i travel a lot business but this real value for money  |  The most what I like is design of the hotel Designer itself is very talented we have visited 3 restaurants that he designed Recommend Bardot Cheri el Nacional Location absolutely perfect  |  Cleaning staff was friendly helpful and trustworthy Quiet hotel Right by a mall and close to downtown transportation within walking distance of many landmarks and attractions Taxi pick up spot located directly across the street by entrance  |  You can t go wrong with the citizenm ever  |  Staff service in restaurant at breakfast was impeccable  |  beds really comfy and staff were amazing with info rooms were brilliant and restaurant breaksfast was fab
ES,Spain,100169,Alameda,1248451,Posada de Jose Maria El Tempranillo,ThreeStar,CARRETERA ALAMEDA-ANTEQUERA KM1 ALAMEDA,Mirador: within 1200 metre  Termas romanas: within 900 metre  Torcal: within 25000 metre,"Located in Alameda, 45 minutes from Malaga and one hour from Cordoba, the country house is set in a quiet atmosphere surrounded by nature.

The charming rural country house has been renovated and has wedding halls, a restaurant and Internet access. There are a total of 21 rooms on offer.

The rooms are predominantly decorated with wood and are luminous and quiet. They have en suite bathrooms with bathtub and hairdryer, as well as a telephone, satellite/cable TV, Internet access and individually regulated air conditioning and heating. Furthermore, they are equipped with a double bed, radio, hifi, safe and minibar.

The establishment offers guests use of an outdoor swimming pool, as well as table tennis and pool/snooker facilities.",Hotel MasterCard Visa Bathroom Bathtub Hairdryer Direct dial telephone TV Radio Hi-fi Minibar Individually adjustable air conditioning Safe Garden Restaurant Table tennis Billiards,37.197|-4.641,,29530,http://www.posadaeltempranillo.com,the location |  Quiet room  |  Everything in the previous questions great place to stay We would definitely go back there again  |  Trafalgar tour |  Modern styled hotel great facilities helpful staff |  Very clean spacious rooms comfortable beds and lots of hot water Perfect for the budget  |  Clean and staff helpful |  Definitely a beautiful hotel Very modern inside and has all the facilities you need The room was very big and comfortable The wellness area was very enjoyable I also really liked that you could get food at the bar at a reasonable price at any time of day  |  They upgraded my stay as I am a frequent traveller |  The location was great we were going to the Apollo and it was literally around the corner
SE,Sweden,123719,Klippan,1072428,Mattisgrden Bed & Breakfast,ThreeStar,Blsinge 4902 26494 Klippan,,"Enjoy the atmosphere of a typical Skne farmhouse from 1850. This intimate B&B provides free WiFi and private parking close to beautiful beaches, nature reserves and the ferries to Denmark.

Just 9 kilometres from the village of Klippan, Mattisgrden Bed & Breakfast offers elegant yet cosy room and apartment options. Some rooms and apartments have their own kitchen facilities, while other rooms include access to a communal kitchen. In addition, Mattisgrden provides communal laundry and drying facilities.

Mattisgrden has several comfortable public areas, including a snug TV room. Unwind in the hotel sauna. Enjoy a relaxing bath in the wood-heated hot tub. A continental breakfast is served daily.

After exploring the surroundings, treat yourself to a home-cooked meal at Mattisgrden. Dinner has to be ordered at least 3 days in advance. If the weather allows, guests can enjoy their food in the terrace outside.

Prepare your own delicious meal by using the barbecue equipment in the terrace.

Mattisgrden uses an environmentally friendly heating system. This property will not accommodate hen, stag or similar parties.
Please inform Mattisgrden Bed & Breakfast in advance of your expected arrival time. You can use the Special Requests box when booking, or contact the property directly with the contact details provided in your confirmation.
In response to Coronavirus (COVID-19), additional safety and sanitation measures are in effect at this property.
Food & beverage services at this property may be limited or unavailable due to Coronavirus (COVID-19).
It is not possible to stay at this property for Coronavirus (COVID-19) quarantine purposes.
Please note that dinner must be booked at least 3 days in advance.

If you expect to arrive outside check-in hours, please inform Mattisgrden Bed & Breakfast in advance.

If you expect to arrive outside check-in hours, please note that Mattisgrden Bed & Breakfast charges up to SEK 300 for late check-in.

Please note that breakfast is served 07:30-08:30 during weekdays, and 08:30-09:30 during weekends. For a surcharge, guests can book an earlier or later breakfast. Contact the property for more information.",Ironing service Free parking internet services BBQ facilities Cycling Heating Fax/photocopying wifi Allergy-free room Free WiFi Non-smoking throughout designated smoking area ATM/cash machine on site Private check-in/check-out Special diet menus (on request) Shared kitchen shared lounge/TV area Daily housekeeping Parking Pets allowed Garden Non-smoking rooms Laundry Family rooms parking on site Private parking wifi available in all areas board games/puzzles kids' outdoor play equipment secured parking electric vehicle charging station Badminton equipment Outdoor furniture Outdoor fireplace Spa/wellness packages 24-hour security Key access Security alarm Smoke alarms CCTV in common areas CCTV outside property Fire extinguishers bicycle rental use of cleaning chemicals that are effective against coronavirus linens  towels and laundry washed in accordance with local authority guidelines guest accommodation sealed after cleaning physical distancing in dining areas staff follow all safety protocols as directed by local authorities shared stationery such as printed menus  magazines  pens  and paper removed hand sanitizer in guest accommodation and key areas first aid kit available contactless check-in/check-out cashless payment available physical distancing rules followed invoice provided all plates  cutlery  glasses and other tableware have been sanitized guests have the option to cancel any cleaning services for their accommodation during their stay breakfast takeaway containers delivered food is securely covered,56.18039|13.0566,+4643521071,264 94,https://www.booking.com/hotel/se/mattisgaden-beed-breakfast.html,Close to Schonbrunn  |  Very comfortable room friendly staff parking on site  |  Decent value for money  |  Room was excellent and the bed was very comfortable |  Great hotel in a quiet location Really friendly staff A great base for your trip to London Highly recommended  |  La situation geographique
SE,Sweden,107127,Vansbro,1785848,Route 26,All,Laxtjarn 17 780 50 Fredriksberg,,"The perfect accommodation when traveling to Slen or Vemdalen/re. Just 2 hours to Slen: eat your breakfast, continue your journey and enjoy a full day of skiing before checking in to your cabin.

Close to Sfsen Resort. And an ideal location visiting the Vansbro Swim or Rally Sweden.

Price includes breakfast, made up bed and towels.

There is free wifi internet and living room with TV. I you bring an infant we can arrange a highchair and cot. In the kitchen there is a coffe maker, microwave and stove. Set in natural surroundings, this B&B is located by Route 26 in Swedens Dalarna region. It offers rooms with free Wi-Fi access and a wardrobe.

All rooms at Route 26 have access to shared shower facilities. 2 rooms have a private toilet. All rooms have a seating area.

A buffet breakfast is served each morning at Route 26 B&B. Canoes are available for rent on site.

Filipstad town centre is 50 minutes drive from Route 26.  The ski resorts of Slen are within 2 hours drive. Please inform Route 26 in advance of your expected arrival time. You can use the Special Requests box when booking, or contact the property directly with the contact details provided in your confirmation.
In response to Coronavirus (COVID-19), additional safety and sanitation measures are in effect at this property.
This property will not accommodate hen, stag or similar parties.
Please note that the Wi-Fi internet connection is down between 00:00 and 06:00.",Parking Non-smoking rooms Fishing Family rooms Free parking internet services Canoeing Heating wifi Free WiFi Non-smoking throughout Shared kitchen shared lounge/TV area parking on site wifi available in all areas use of cleaning chemicals that are effective against coronavirus linens  towels and laundry washed in accordance with local authority guidelines guest accommodation is disinfected between stays physical distancing in dining areas staff follow all safety protocols as directed by local authorities shared stationery such as printed menus  magazines  pens  and paper removed hand sanitizer in guest accommodation and key areas first aid kit available cashless payment available physical distancing rules followed invoice provided all plates  cutlery  glasses and other tableware have been sanitized guests have the option to cancel any cleaning services for their accommodation during their stay,60.25215|14.17409,,78050,https://www.booking.com/hotel/se/route-26.html,Room clean and warm |  There isn t much that appealed in this hotel however the Whisky Bar was comfortable and less crowded  |  location room atmosphere |  The beds were extremely comfortable and the rooms were cleaned to a great standard every day  |  close to train station and city center |  A wonderful hotel with wonderfully friendly and helpful staff Pros Proximity to tube station and eateries great atmosphere breakfast room size  |  Excellent location Very modern decor Perfect for us we travelled as 3 young couples Great location We were also treated to champagne on arrival as it was 3 of our parties birthdays purpose of the trip could not fault the hotel All staff were very friendly and the staff on reception desk in particular were very helpful when we asked for specific info on restaurants ect
AE,United Arab Emirates,115936,Dubai,5007871,Millennium Place Mirdif Apartments,All,"PO Box 10052 ,78th Street , The Avenue ,Mirdif Hills UAE, Dubai, United Arab Emirates ",,"With Sahara Centre reachable in 16 km, Millennium Place Mirdif Apartments features accommodation, a restaurant, an outdoor swimming pool, a garden and a shared lounge. Free WiFi is available.

Each unit has a balcony, a satellite flat-screen TV, a seating area, a well-fitted kitchen and a private bathroom with shower, free toiletries and a hairdryer.

The daily breakfast offers continental, American or Asian options.

Free private parking and a business centre are available, as well as a 24-hour front desk.

A terrace is available for guests to use at the aparthotel.

Grand Mosque is 18 km from Millennium Place Mirdif Apartments, while Dubai World Trade Centre is 21 km from the property. The nearest airport is Dubai International, 9 km from the accommodation, and the property offers a paid airport shuttle service. A damage deposit of AED 500 is required on arrival. This will be collected as a cash payment. You should be reimbursed on check-out. Your deposit will be refunded in full in cash, subject to an inspection of the property.",Parking Restaurant Room service meeting/banquet facilities Bar 24-hour front desk Sauna Garden Terrace Non-smoking rooms Airport shuttle Business centre Laundry dry cleaning Facilities for disabled guests Family rooms Games room Ironing service Free parking internet services lift express check-in/check-out Safety Deposit Box Valet parking Currency exchange Spa and wellness centre Massage Soundproof rooms Car hire Tour desk Fax/photocopying Luggage storage wifi Outdoor pool Free WiFi Air conditioning designated smoking area outdoor pool (all year) concierge service Trouser press airport shuttle (additional charge) shared lounge/TV area minimarket on site Daily housekeeping grocery deliveries parking on site Private parking secured parking Accessible parking Wheelchair accessible Toilet with grab rails linens  towels and laundry washed in accordance with local authority guidelines Higher level toilet guest accommodation is disinfected between stays Lower bathroom sink guest accommodation sealed after cleaning Rooftop pool physical distancing in dining areas Pool with view food can be delivered to guest accommodation Pool Bar sun loungers or beach chairs Outdoor furniture Fence around pool Back massage Neck massage Foot massage Head massage Hand massage Full body massage kids' pool Swimming pool 24-hour security Security alarm Smoke alarms CCTV in common areas CCTV outside property Fire extinguishers Swimming pool bicycle rental use of cleaning chemicals that are effective against coronavirus staff follow all safety protocols as directed by local authorities shared stationery such as printed menus  magazines  pens  and paper removed hand sanitizer in guest accommodation and key areas process in place to check health of guests first aid kit available contactless check-in/check-out cashless payment available physical distancing rules followed screens or physical barriers placed between staff and guests in appropriate areas invoice provided property is cleaned by professional cleaning companies all plates  cutlery  glasses and other tableware have been sanitized guests have the option to cancel any cleaning services for their accommodation during their stay breakfast takeaway containers delivered food is securely covered thermometers for guests provided by property face masks for guests available,25.22613|55.44135,,,https://www.booking.com/hotel/ae/millennium-place-mirdif-apartments.html,the places is amazing |  The position is ideal as you are near to many popular sites and restaurants  |  The location is amazing and I also lover the roof top pool  |  All staff were very attentive and welcoming we booked for a special occasion and thoroughly enjoyed our stay  |  The staff went out of their way to help you and were very friendly The free shuttle service was a nice touch  |  Perfect location in the walking distance of porte maillot and arch de triomphe room was silent despite the close location of a big street also room size was sufficient  |  Great hotel with amazing location right next to Milano Central Station and Centrale metro station friendly staff very comfortable beds sound proof rooms and very nice half board with variety of food Would definitely come back  |  It s really an old hotel the lobby is astonishment attracting Heater work well and enough
GB,United Kingdom,100438,Aberdare,5348034,Sunnyside Lodge,FourStar,Sunnyside Lodge Cwmbach,,"Sunnyside Lodge is located in Cwmbach. The accommodation is 49 km from Newport.

The holiday home features 1 bedroom, a TV, an equipped kitchen with a microwave and a fridge, a washing machine, and 1 bathroom with a hot tub.

Guests at the holiday home can enjoy golfing and cycling nearby, or make the most of the garden.

Cardiff is 35 km from Sunnyside Lodge, while Swansea is 48 km away. The nearest airport is Cardiff Airport, 53 km from the accommodation. Guests are required to show a photo identification and credit card upon check-in. Please note that all Special Requests are subject to availability and additional charges may apply.
Please note that the check-in and key-collection take place at: ,  .
This property will not accommodate hen, stag or similar parties.
One well behaved dog welcome",Golf course (within 3 km) Garden wifi Heating Pets allowed Free WiFi internet services Fishing Street parking Cycling wifi available in all areas Non-smoking throughout On-site parking,51.70282|-3.40513,,CF44 0DA,https://www.booking.com/hotel/gb/sunnyside-lodge.html,Carpark |  Nice stuff Close to the center Very good breakfast |  the location was fantastic and the bed was clean  |  Staff extremely helpful and hotel within walking distance to both sights and shops  |  Excellent position very friendly staff  |  Nice view from the roof top  |  Great room with complimentary coffee water and cava for our anniversary Very spacious clean and comfortable
GB,United Kingdom,100636,Alexandria,5648908,Cameron House Detached Lodge L45,All,Cameron House Lodges,,"Cameron House Two bedroom Detached Lodge L45 offers accommodation in Balloch, 6 km from Balloch Castle Country Park. This property offers access to a balcony, free private parking and free WiFi.

This holiday home is equipped with 2 bedrooms, a kitchen with a dishwasher and a microwave, a flat-screen TV, a seating area and 2 bathrooms. Important update: The Spa, The Carrick Golf Course, The Wee Demon Golf Course, The Boat House Bar & Restaurant and The Claret Jug Bar & Restaurant are open as normal. However, the main hotel and its facilities, including the Leisure Club, are currently closed. Cameron Lodges guests are able to use the leisure facilities at the Spa which is located at the Carrick estate and also the Meadow Leisure Centre in Dumbarton. A shuttle service runs frequently between Cameron House and The Carrick Estate. Please note that the lodges at Cameron House temporarily have no Wi-Fi but we are working hard to rectify this. The Cameron Club lodges have full Wi-Fi. For more information regarding any of the above, please email",Free WiFi Swimming pool Parking wifi available in all areas On-site parking breakfast options invoices Swimming pool Free parking internet services Private parking wifi,56.01326|-4.60689,,G83 8RE,https://www.booking.com/hotel/gb/cameron-house-two-bedroom-detached-lodge-l45.html,Very beautiful building cozy room cool bar  |  Excellent if attending events at theo2 |  The hotel is so beautiful and clean  |  Reception and the service was excellent Location is great breakfast is a real Full English |  Air conditioning excellent comfortable bed reasonable space  |  The sympathy of the employees The location is 10min walkinng from the Vienna Opera  |  Great location Super helpful staff with great service Eg printed out maps for us and explained where to go Excellent shop next door for convince Could not find fault with anything |  Wonderful hotel wonderful staff wonderful room wonderful stay Absolutely perfect and will definitely be staying again on another visit to London Thank you The Belgrave  |  Small room but with large showroom disabled set up comfortable bed tea coffee etc al very good |  Excellent location and fantastic buffet breakfast Beds comfy and everything very clean Staff always helpful Easy access to metro or staff will call a cab which arrives within a minute or two Great shopping and restaurants nearby and a nice walk into Duomo area if you want some exercise
